{
  "schema_version": "eval-1.0",
  "seed": 3,
  "generated_at": "2026-08-01T16:00:00+00:00",
  "corpus_size": 56,
  "items": [
    {
      "item_id": "genuine-30000",
      "species": "genuine",
      "expected_decision": "accept",
      "expected_check": null,
      "actual_decision": "accept",
      "actual_failing_checks": [],
      "outcome_category": "accepted_correctly",
      "total_ms": 0.21983403712511063
    },
    {
      "item_id": "genuine-30001",
      "species": "genuine",
      "expected_decision": "accept",
      "expected_check": null,
      "actual_decision": "accept",
      "actual_failing_checks": [],
      "outcome_category": "accepted_correctly",
      "total_ms": 0.2047908492386341
    },
    {
      "item_id": "genuine-30002",
      "species": "genuine",
      "expected_decision": "accept",
      "expected_check": null,
      "actual_decision": "accept",
      "actual_failing_checks": [],
      "outcome_category": "accepted_correctly",
      "total_ms": 0.19575003534555435
    },
    {
      "item_id": "genuine-30003",
      "species": "genuine",
      "expected_decision": "accept",
      "expected_check": null,
      "actual_decision": "accept",
      "actual_failing_checks": [],
      "outcome_category": "accepted_correctly",
      "total_ms": 0.19370787777006626
    },
    {
      "item_id": "genuine-30004",
      "species": "genuine",
      "expected_decision": "accept",
      "expected_check": null,
      "actual_decision": "accept",
      "actual_failing_checks": [],
      "outcome_category": "accepted_correctly",
      "total_ms": 0.19945786334574223
    },
    {
      "item_id": "genuine-30005",
      "species": "genuine",
      "expected_decision": "accept",
      "expected_check": null,
      "actual_decision": "accept",
      "actual_failing_checks": [],
      "outcome_category": "accepted_correctly",
      "total_ms": 0.18700002692639828
    },
    {
      "item_id": "genuine-30006",
      "species": "genuine",
      "expected_decision": "accept",
      "expected_check": null,
      "actual_decision": "accept",
      "actual_failing_checks": [],
      "outcome_category": "accepted_correctly",
      "total_ms": 0.18833321519196033
    },
    {
      "item_id": "genuine-30007",
      "species": "genuine",
      "expected_decision": "accept",
      "expected_check": null,
      "actual_decision": "accept",
      "actual_failing_checks": [],
      "outcome_category": "accepted_correctly",
      "total_ms": 0.19179098308086395
    },
    {
      "item_id": "broken_issuer_signature-30008",
      "species": "broken_issuer_signature",
      "expected_decision": "reject",
      "expected_check": "issuer_signature",
      "actual_decision": "reject",
      "actual_failing_checks": [
        "issuer_signature"
      ],
      "outcome_category": "caught",
      "total_ms": 0.10799989104270935
    },
    {
      "item_id": "broken_issuer_signature-30009",
      "species": "broken_issuer_signature",
      "expected_decision": "reject",
      "expected_check": "issuer_signature",
      "actual_decision": "reject",
      "actual_failing_checks": [
        "issuer_signature"
      ],
      "outcome_category": "caught",
      "total_ms": 0.0980838667601347
    },
    {
      "item_id": "broken_issuer_signature-30010",
      "species": "broken_issuer_signature",
      "expected_decision": "reject",
      "expected_check": "issuer_signature",
      "actual_decision": "reject",
      "actual_failing_checks": [
        "issuer_signature"
      ],
      "outcome_category": "caught",
      "total_ms": 0.09949994273483753
    },
    {
      "item_id": "broken_issuer_signature-30011",
      "species": "broken_issuer_signature",
      "expected_decision": "reject",
      "expected_check": "issuer_signature",
      "actual_decision": "reject",
      "actual_failing_checks": [
        "issuer_signature"
      ],
      "outcome_category": "caught",
      "total_ms": 0.09587500244379044
    },
    {
      "item_id": "altered_disclosed_claim-30012",
      "species": "altered_disclosed_claim",
      "expected_decision": "reject",
      "expected_check": "disclosure_integrity",
      "actual_decision": "reject",
      "actual_failing_checks": [
        "disclosure_integrity"
      ],
      "outcome_category": "caught",
      "total_ms": 0.09799981489777565
    },
    {
      "item_id": "altered_disclosed_claim-30013",
      "species": "altered_disclosed_claim",
      "expected_decision": "reject",
      "expected_check": "disclosure_integrity",
      "actual_decision": "reject",
      "actual_failing_checks": [
        "disclosure_integrity"
      ],
      "outcome_category": "caught",
      "total_ms": 0.09645801037549973
    },
    {
      "item_id": "altered_disclosed_claim-30014",
      "species": "altered_disclosed_claim",
      "expected_decision": "reject",
      "expected_check": "disclosure_integrity",
      "actual_decision": "reject",
      "actual_failing_checks": [
        "disclosure_integrity"
      ],
      "outcome_category": "caught",
      "total_ms": 0.09512482210993767
    },
    {
      "item_id": "altered_disclosed_claim-30015",
      "species": "altered_disclosed_claim",
      "expected_decision": "reject",
      "expected_check": "disclosure_integrity",
      "actual_decision": "reject",
      "actual_failing_checks": [
        "disclosure_integrity"
      ],
      "outcome_category": "caught",
      "total_ms": 0.09833299554884434
    },
    {
      "item_id": "stripped_kb_jwt-30016",
      "species": "stripped_kb_jwt",
      "expected_decision": "reject",
      "expected_check": "key_binding",
      "actual_decision": "reject",
      "actual_failing_checks": [
        "key_binding"
      ],
      "outcome_category": "caught",
      "total_ms": 0.09024981409311295
    },
    {
      "item_id": "stripped_kb_jwt-30017",
      "species": "stripped_kb_jwt",
      "expected_decision": "reject",
      "expected_check": "key_binding",
      "actual_decision": "reject",
      "actual_failing_checks": [
        "key_binding"
      ],
      "outcome_category": "caught",
      "total_ms": 0.0913750845938921
    },
    {
      "item_id": "stripped_kb_jwt-30018",
      "species": "stripped_kb_jwt",
      "expected_decision": "reject",
      "expected_check": "key_binding",
      "actual_decision": "reject",
      "actual_failing_checks": [
        "key_binding"
      ],
      "outcome_category": "caught",
      "total_ms": 0.08929101750254631
    },
    {
      "item_id": "stripped_kb_jwt-30019",
      "species": "stripped_kb_jwt",
      "expected_decision": "reject",
      "expected_check": "key_binding",
      "actual_decision": "reject",
      "actual_failing_checks": [
        "key_binding"
      ],
      "outcome_category": "caught",
      "total_ms": 0.08904188871383667
    },
    {
      "item_id": "wrong_audience_kb_jwt-30020",
      "species": "wrong_audience_kb_jwt",
      "expected_decision": "reject",
      "expected_check": "key_binding",
      "actual_decision": "reject",
      "actual_failing_checks": [
        "key_binding"
      ],
      "outcome_category": "caught",
      "total_ms": 0.19145896658301353
    },
    {
      "item_id": "wrong_audience_kb_jwt-30021",
      "species": "wrong_audience_kb_jwt",
      "expected_decision": "reject",
      "expected_check": "key_binding",
      "actual_decision": "reject",
      "actual_failing_checks": [
        "key_binding"
      ],
      "outcome_category": "caught",
      "total_ms": 0.18700002692639828
    },
    {
      "item_id": "wrong_audience_kb_jwt-30022",
      "species": "wrong_audience_kb_jwt",
      "expected_decision": "reject",
      "expected_check": "key_binding",
      "actual_decision": "reject",
      "actual_failing_checks": [
        "key_binding"
      ],
      "outcome_category": "caught",
      "total_ms": 0.18670805729925632
    },
    {
      "item_id": "wrong_audience_kb_jwt-30023",
      "species": "wrong_audience_kb_jwt",
      "expected_decision": "reject",
      "expected_check": "key_binding",
      "actual_decision": "reject",
      "actual_failing_checks": [
        "key_binding"
      ],
      "outcome_category": "caught",
      "total_ms": 0.1871669664978981
    },
    {
      "item_id": "stale_nonce_kb_jwt-30024",
      "species": "stale_nonce_kb_jwt",
      "expected_decision": "reject",
      "expected_check": "key_binding",
      "actual_decision": "reject",
      "actual_failing_checks": [
        "key_binding"
      ],
      "outcome_category": "caught",
      "total_ms": 0.19370811060070992
    },
    {
      "item_id": "stale_nonce_kb_jwt-30025",
      "species": "stale_nonce_kb_jwt",
      "expected_decision": "reject",
      "expected_check": "key_binding",
      "actual_decision": "reject",
      "actual_failing_checks": [
        "key_binding"
      ],
      "outcome_category": "caught",
      "total_ms": 0.18612504936754704
    },
    {
      "item_id": "stale_nonce_kb_jwt-30026",
      "species": "stale_nonce_kb_jwt",
      "expected_decision": "reject",
      "expected_check": "key_binding",
      "actual_decision": "reject",
      "actual_failing_checks": [
        "key_binding"
      ],
      "outcome_category": "caught",
      "total_ms": 0.1860419288277626
    },
    {
      "item_id": "stale_nonce_kb_jwt-30027",
      "species": "stale_nonce_kb_jwt",
      "expected_decision": "reject",
      "expected_check": "key_binding",
      "actual_decision": "reject",
      "actual_failing_checks": [
        "key_binding"
      ],
      "outcome_category": "caught",
      "total_ms": 0.1852919813245535
    },
    {
      "item_id": "issuer_not_on_trusted_list-30028",
      "species": "issuer_not_on_trusted_list",
      "expected_decision": "reject",
      "expected_check": "trust_path",
      "actual_decision": "reject",
      "actual_failing_checks": [
        "trust_path"
      ],
      "outcome_category": "caught",
      "total_ms": 0.09404192678630352
    },
    {